{
  "$schema": "https://next.park-ui.com/schema/registry-item.json",
  "name": "textarea-recipe",
  "type": "registry:recipe",
  "dependencies": ["@pandacss/dev"],
  "files": [
    {
      "content": "import { defineRecipe } from '@pandacss/dev'\n\nexport const textarea = defineRecipe({\n  className: 'textarea',\n  jsx: ['Textarea', 'Field.Textarea'],\n  base: {\n    '--error-color': 'colors.fg.error',\n    '--focus-color': 'colors.colorPalette.solid',\n    appearance: 'none',\n    borderRadius: 'l2',\n    minWidth: '0',\n    outline: '0',\n    position: 'relative',\n    textAlign: 'start',\n    transitionDuration: 'normal',\n    transitionProperty: 'box-shadow, border-color',\n    transitionTimingFunction: 'default',\n    width: '100%',\n    _disabled: {\n      layerStyle: 'disabled',\n    },\n  },\n  defaultVariants: {\n    size: 'md',\n    variant: 'outline',\n  },\n  variants: {\n    variant: {\n      outline: {\n        bg: 'transparent',\n        borderWidth: '1px',\n        borderColor: 'gray.a7',\n        color: 'gray.12',\n        focusVisibleRing: 'inside',\n        focusRingColor: 'var(--focus-color)',\n        _invalid: {\n          focusRingColor: 'var(--error-color)',\n          borderColor: 'var(--error-color)',\n        },\n      },\n      subtle: {\n        borderWidth: '1px',\n        borderColor: 'transparent',\n        background: 'gray.a3',\n        color: 'gray.fg',\n        focusVisibleRing: 'inside',\n        focusRingColor: 'var(--focus-color)',\n        _invalid: {\n          focusRingColor: 'var(--error-color)',\n        },\n      },\n      flushed: {\n        bg: 'transparent',\n        borderBottomWidth: '1px',\n        borderBottomColor: 'gray.a7',\n        borderRadius: '0',\n        color: 'gray.12',\n        px: '0',\n        _invalid: {\n          borderColor: 'var(--error-color)',\n          boxShadow: '0px 1px 0px 0px var(--error-color)',\n        },\n        _focusVisible: {\n          borderColor: 'var(--focus-color)',\n          boxShadow: '0px 1px 0px 0px var(--focus-color)',\n          _invalid: {\n            borderColor: 'var(--error-color)',\n            boxShadow: '0px 1px 0px 0px var(--error-color)',\n          },\n        },\n      },\n    },\n    size: {\n      sm: { p: '2.5', fontSize: 'sm', scrollPaddingBottom: '2.5' },\n      md: { p: '3', fontSize: 'md', scrollPaddingBottom: '3' },\n      lg: { p: '3.5', fontSize: 'md', scrollPaddingBottom: '3.5' },\n      xl: { p: '4', fontSize: 'md', scrollPaddingBottom: '4' },\n    },\n  },\n})\n",
      "type": "registry:recipe",
      "path": "textarea.ts"
    }
  ]
}
