{
  "$schema": "https://next.park-ui.com/schema/registry-item.json",
  "name": "spinner",
  "type": "registry:ui",
  "dependencies": ["@ark-ui/react", "react"],
  "files": [
    {
      "content": "import { ark } from '@ark-ui/react/factory'\nimport type { ComponentProps } from 'react'\nimport { styled } from 'styled-system/jsx'\nimport { spinner } from 'styled-system/recipes'\n\nexport type SpinnerProps = ComponentProps<typeof Spinner>\nexport const Spinner = styled(ark.span, spinner)\n",
      "type": "registry:ui",
      "path": "ui/spinner.tsx"
    }
  ],
  "registryDependencies": ["spinner-recipe"]
}
