{
  "$schema": "https://next.park-ui.com/schema/registry-item.json",
  "name": "radio-card-group",
  "type": "registry:ui",
  "dependencies": ["@ark-ui/solid", "solid-js"],
  "files": [
    {
      "content": "import { RadioGroup } from '@ark-ui/solid/radio-group'\nimport type { ComponentProps } from 'solid-js'\nimport { createStyleContext } from 'styled-system/jsx'\nimport { radioCardGroup } from 'styled-system/recipes'\n\nconst { withProvider, withContext } = createStyleContext(radioCardGroup)\n\nexport type RootProps = ComponentProps<typeof Root>\nexport const Root = withProvider(RadioGroup.Root, 'root')\nexport const RootProvider = withProvider(RadioGroup.RootProvider, 'root')\nexport const Indicator = withContext(RadioGroup.Indicator, 'indicator')\nexport const Item = withContext(RadioGroup.Item, 'item')\nexport const ItemControl = withContext(RadioGroup.ItemControl, 'itemControl')\nexport const ItemText = withContext(RadioGroup.ItemText, 'itemText')\nexport const Label = withContext(RadioGroup.Label, 'label')\nexport const ItemHiddenInput = RadioGroup.ItemHiddenInput\n\nexport { RadioGroupContext as Context } from '@ark-ui/solid/radio-group'\n",
      "type": "registry:ui",
      "path": "radio-card-group.tsx"
    }
  ],
  "registryDependencies": ["radio-card-group-recipe"]
}
