{
  "$schema": "https://park-ui.com/schema/registry-item.json",
  "name": "cyan",
  "type": "registry:color",
  "dependencies": ["@pandacss/dev"],
  "files": [
    {
      "content": "import { defineSemanticTokens } from '@pandacss/dev'\n\nexport const cyan = defineSemanticTokens.colors({\n  '1': { value: { _light: '#fafdfe', _dark: '#0b161a' } },\n  '2': { value: { _light: '#f2fafb', _dark: '#101b20' } },\n  '3': { value: { _light: '#def7f9', _dark: '#082c36' } },\n  '4': { value: { _light: '#caf1f6', _dark: '#003848' } },\n  '5': { value: { _light: '#b5e9f0', _dark: '#004558' } },\n  '6': { value: { _light: '#9ddde7', _dark: '#045468' } },\n  '7': { value: { _light: '#7dcedc', _dark: '#12677e' } },\n  '8': { value: { _light: '#3db9cf', _dark: '#11809c' } },\n  '9': { value: { _light: '#00a2c7', _dark: '#00a2c7' } },\n  '10': { value: { _light: '#0797b9', _dark: '#23afd0' } },\n  '11': { value: { _light: '#107d98', _dark: '#4ccce6' } },\n  '12': { value: { _light: '#0d3c48', _dark: '#b6ecf7' } },\n  a1: { value: { _light: '#0099cc05', _dark: '#0091f70a' } },\n  a2: { value: { _light: '#009db10d', _dark: '#02a7f211' } },\n  a3: { value: { _light: '#00c2d121', _dark: '#00befd28' } },\n  a4: { value: { _light: '#00bcd435', _dark: '#00baff3b' } },\n  a5: { value: { _light: '#01b4cc4a', _dark: '#00befd4d' } },\n  a6: { value: { _light: '#00a7c162', _dark: '#00c7fd5e' } },\n  a7: { value: { _light: '#009fbb82', _dark: '#14cdff75' } },\n  a8: { value: { _light: '#00a3c0c2', _dark: '#11cfff95' } },\n  a9: { value: { _light: '#00a2c7', _dark: '#00cfffc3' } },\n  a10: { value: { _light: '#0094b7f8', _dark: '#28d6ffcd' } },\n  a11: { value: { _light: '#007491ef', _dark: '#52e1fee5' } },\n  a12: { value: { _light: '#00323ef2', _dark: '#bbf3fef7' } },\n  solid: {\n    bg: {\n      DEFAULT: { value: { _light: '{colors.cyan.9}', _dark: '{colors.cyan.9}' } },\n      hover: { value: { _light: '{colors.cyan.10}', _dark: '{colors.cyan.10}' } },\n    },\n    fg: { DEFAULT: { value: { _light: 'white', _dark: 'white' } } },\n  },\n  subtle: {\n    bg: {\n      DEFAULT: { value: { _light: '{colors.cyan.a3}', _dark: '{colors.cyan.a3}' } },\n      hover: { value: { _light: '{colors.cyan.a4}', _dark: '{colors.cyan.a4}' } },\n      active: { value: { _light: '{colors.cyan.a5}', _dark: '{colors.cyan.a5}' } },\n    },\n    fg: { DEFAULT: { value: { _light: '{colors.cyan.a11}', _dark: '{colors.cyan.a11}' } } },\n  },\n  surface: {\n    bg: {\n      DEFAULT: { value: { _light: '{colors.cyan.a2}', _dark: '{colors.cyan.a2}' } },\n      active: { value: { _light: '{colors.cyan.a3}', _dark: '{colors.cyan.a3}' } },\n    },\n    border: {\n      DEFAULT: { value: { _light: '{colors.cyan.a6}', _dark: '{colors.cyan.a6}' } },\n      hover: { value: { _light: '{colors.cyan.a7}', _dark: '{colors.cyan.a7}' } },\n    },\n    fg: { DEFAULT: { value: { _light: '{colors.cyan.a11}', _dark: '{colors.cyan.a11}' } } },\n  },\n  outline: {\n    bg: {\n      hover: { value: { _light: '{colors.cyan.a2}', _dark: '{colors.cyan.a2}' } },\n      active: { value: { _light: '{colors.cyan.a3}', _dark: '{colors.cyan.a3}' } },\n    },\n    border: { DEFAULT: { value: { _light: '{colors.cyan.a7}', _dark: '{colors.cyan.a7}' } } },\n    fg: { DEFAULT: { value: { _light: '{colors.cyan.a11}', _dark: '{colors.cyan.a11}' } } },\n  },\n  plain: {\n    bg: {\n      hover: { value: { _light: '{colors.cyan.a3}', _dark: '{colors.cyan.a3}' } },\n      active: { value: { _light: '{colors.cyan.a4}', _dark: '{colors.cyan.a4}' } },\n    },\n    fg: { DEFAULT: { value: { _light: '{colors.cyan.a11}', _dark: '{colors.cyan.a11}' } } },\n  },\n})\n",
      "type": "registry:color",
      "path": "colors/cyan.ts"
    }
  ],
  "panda": {
    "imports": [
      {
        "type": "registry:color",
        "name": "cyan",
        "from": "colors/cyan"
      }
    ],
    "extension": {
      "theme": {
        "extend": {
          "semanticTokens": {
            "colors": {
              "cyan": "$ref:cyan"
            }
          }
        }
      }
    }
  }
}
