{
  "$schema": "https://next.park-ui.com/schema/registry-item.json",
  "name": "hover-card-recipe",
  "type": "registry:recipe",
  "dependencies": ["@pandacss/dev", "@ark-ui/react"],
  "files": [
    {
      "content": "import { hoverCardAnatomy } from '@ark-ui/react/hover-card'\nimport { defineSlotRecipe } from '@pandacss/dev'\n\nexport const hoverCard = defineSlotRecipe({\n  className: 'hover-card',\n  slots: hoverCardAnatomy.keys(),\n  base: {\n    content: {\n      '--hovercard-bg': 'colors.bg.default',\n\n      bg: 'var(--hovercard-bg)',\n      borderRadius: 'l3',\n      boxShadow: 'lg',\n      display: 'flex',\n      flexDirection: 'column',\n      maxWidth: '80',\n      outline: '0',\n      padding: '4',\n      position: 'relative',\n      textStyle: 'sm',\n      transformOrigin: 'var(--transform-origin)',\n      zIndex: 'popover',\n      _open: {\n        animationStyle: 'slide-fade-in',\n        animationDuration: 'fast',\n      },\n      _closed: {\n        animationStyle: 'slide-fade-out',\n        animationDuration: 'faster',\n      },\n    },\n    arrow: {\n      '--arrow-size': 'sizes.3',\n      '--arrow-background': 'var(--hovercard-bg)',\n    },\n    arrowTip: {\n      borderTopWidth: '0.5px',\n      borderInlineStartWidth: '0.5px',\n    },\n  },\n})\n",
      "type": "registry:recipe",
      "path": "recipes/hover-card.ts"
    }
  ]
}
