{
  "$schema": "https://next.park-ui.com/schema/registry-item.json",
  "name": "input-element",
  "type": "registry:ui",
  "dependencies": ["@ark-ui/solid", "solid-js"],
  "files": [
    {
      "content": "import { ark } from '@ark-ui/solid/factory'\nimport type { ComponentProps } from 'solid-js'\nimport { styled } from 'styled-system/jsx'\nimport { inputElement } from 'styled-system/recipes'\n\nexport type InputElementProps = ComponentProps<typeof InputElement>\nexport const InputElement = styled(ark.div, inputElement)\n",
      "type": "registry:ui",
      "path": "input-element.tsx"
    }
  ],
  "registryDependencies": ["input-element-recipe"]
}
