{
  "$schema": "https://next.park-ui.com/schema/registry-item.json",
  "name": "indigo",
  "type": "registry:color",
  "dependencies": ["@pandacss/dev"],
  "files": [
    {
      "content": "import { defineSemanticTokens } from '@pandacss/dev'\n\nexport const indigo = defineSemanticTokens.colors({\n  '1': { value: { _light: '#fdfdfe', _dark: '#11131f' } },\n  '2': { value: { _light: '#f7f9ff', _dark: '#141726' } },\n  '3': { value: { _light: '#edf2fe', _dark: '#182449' } },\n  '4': { value: { _light: '#e1e9ff', _dark: '#1d2e62' } },\n  '5': { value: { _light: '#d2deff', _dark: '#253974' } },\n  '6': { value: { _light: '#c1d0ff', _dark: '#304384' } },\n  '7': { value: { _light: '#abbdf9', _dark: '#3a4f97' } },\n  '8': { value: { _light: '#8da4ef', _dark: '#435db1' } },\n  '9': { value: { _light: '#3e63dd', _dark: '#3e63dd' } },\n  '10': { value: { _light: '#3358d4', _dark: '#5472e4' } },\n  '11': { value: { _light: '#3a5bc7', _dark: '#9eb1ff' } },\n  '12': { value: { _light: '#1f2d5c', _dark: '#d6e1ff' } },\n  a1: { value: { _light: '#00008002', _dark: '#1133ff0f' } },\n  a2: { value: { _light: '#0040ff08', _dark: '#3354fa17' } },\n  a3: { value: { _light: '#0047f112', _dark: '#2f62ff3c' } },\n  a4: { value: { _light: '#0044ff1e', _dark: '#3566ff57' } },\n  a5: { value: { _light: '#0044ff2d', _dark: '#4171fd6b' } },\n  a6: { value: { _light: '#003eff3e', _dark: '#5178fd7c' } },\n  a7: { value: { _light: '#0037ed54', _dark: '#5a7fff90' } },\n  a8: { value: { _light: '#0034dc72', _dark: '#5b81feac' } },\n  a9: { value: { _light: '#0031d2c1', _dark: '#4671ffdb' } },\n  a10: { value: { _light: '#002ec9cc', _dark: '#5c7efee3' } },\n  a11: { value: { _light: '#002bb7c5', _dark: '#9eb1ff' } },\n  a12: { value: { _light: '#001046e0', _dark: '#d6e1ff' } },\n  solid: {\n    bg: {\n      DEFAULT: { value: { _light: '{colors.indigo.9}', _dark: '{colors.indigo.9}' } },\n      hover: { value: { _light: '{colors.indigo.10}', _dark: '{colors.indigo.10}' } },\n    },\n    fg: { DEFAULT: { value: { _light: 'white', _dark: 'white' } } },\n  },\n  subtle: {\n    bg: {\n      DEFAULT: { value: { _light: '{colors.indigo.a3}', _dark: '{colors.indigo.a3}' } },\n      hover: { value: { _light: '{colors.indigo.a4}', _dark: '{colors.indigo.a4}' } },\n      active: { value: { _light: '{colors.indigo.a5}', _dark: '{colors.indigo.a5}' } },\n    },\n    fg: { DEFAULT: { value: { _light: '{colors.indigo.a11}', _dark: '{colors.indigo.a11}' } } },\n  },\n  surface: {\n    bg: {\n      DEFAULT: { value: { _light: '{colors.indigo.a2}', _dark: '{colors.indigo.a2}' } },\n      active: { value: { _light: '{colors.indigo.a3}', _dark: '{colors.indigo.a3}' } },\n    },\n    border: {\n      DEFAULT: { value: { _light: '{colors.indigo.a6}', _dark: '{colors.indigo.a6}' } },\n      hover: { value: { _light: '{colors.indigo.a7}', _dark: '{colors.indigo.a7}' } },\n    },\n    fg: { DEFAULT: { value: { _light: '{colors.indigo.a11}', _dark: '{colors.indigo.a11}' } } },\n  },\n  outline: {\n    bg: {\n      hover: { value: { _light: '{colors.indigo.a2}', _dark: '{colors.indigo.a2}' } },\n      active: { value: { _light: '{colors.indigo.a3}', _dark: '{colors.indigo.a3}' } },\n    },\n    border: { DEFAULT: { value: { _light: '{colors.indigo.a7}', _dark: '{colors.indigo.a7}' } } },\n    fg: { DEFAULT: { value: { _light: '{colors.indigo.a11}', _dark: '{colors.indigo.a11}' } } },\n  },\n  plain: {\n    bg: {\n      hover: { value: { _light: '{colors.indigo.a3}', _dark: '{colors.indigo.a3}' } },\n      active: { value: { _light: '{colors.indigo.a4}', _dark: '{colors.indigo.a4}' } },\n    },\n    fg: { DEFAULT: { value: { _light: '{colors.indigo.a11}', _dark: '{colors.indigo.a11}' } } },\n  },\n})\n",
      "type": "registry:color",
      "path": "colors/indigo.ts"
    }
  ],
  "panda": {
    "imports": [
      {
        "type": "registry:color",
        "name": "indigo",
        "from": "colors/indigo"
      }
    ],
    "extension": {
      "theme": {
        "extend": {
          "semanticTokens": {
            "colors": {
              "indigo": "$ref:indigo"
            }
          }
        }
      }
    }
  }
}
