{
  "$schema": "https://next.park-ui.com/schema/registry-item.json",
  "name": "carousel-recipe",
  "type": "registry:recipe",
  "dependencies": ["@pandacss/dev", "@ark-ui/react"],
  "files": [
    {
      "content": "import { carouselAnatomy } from '@ark-ui/react/carousel'\nimport { defineSlotRecipe } from '@pandacss/dev'\n\nexport const carousel = defineSlotRecipe({\n  className: 'carousel',\n  slots: carouselAnatomy.keys(),\n  base: {\n    root: {\n      position: 'relative',\n      display: 'flex',\n      flexDirection: 'column',\n      gap: '2',\n      _vertical: {\n        flexDirection: 'row',\n      },\n    },\n    control: {\n      alignItems: 'center',\n      justifyContent: 'space-between',\n      borderRadius: 'l2',\n      display: 'flex',\n      _vertical: {\n        flexDirection: 'column',\n      },\n    },\n    itemGroup: {\n      flex: '1',\n    },\n    indicatorGroup: {\n      display: 'flex',\n      _vertical: {\n        flexDirection: 'column',\n      },\n    },\n    indicator: {\n      borderRadius: 'full',\n      background: 'gray.subtle.bg',\n      cursor: 'pointer',\n      _current: {\n        background: 'colorPalette.solid.bg',\n      },\n      focusVisibleRing: 'outside',\n      focusRingColor: 'colorPalette.solid.bg',\n    },\n  },\n  defaultVariants: {\n    size: 'md',\n  },\n  variants: {\n    inline: {\n      true: {\n        control: {\n          background: { _light: 'white.a11', _dark: 'black.a11' },\n          bottom: '3',\n          left: '50%',\n          p: '1',\n          position: 'absolute',\n          transform: 'translateX(-50%)',\n        },\n      },\n    },\n    size: {\n      md: {\n        control: {\n          gap: '3',\n        },\n        indicatorGroup: {\n          gap: '3',\n        },\n        indicator: {\n          boxSize: '2.5',\n        },\n      },\n    },\n  },\n})\n",
      "type": "registry:recipe",
      "path": "carousel.ts"
    }
  ]
}
