{
  "$schema": "https://next.park-ui.com/schema/registry-item.json",
  "name": "clipboard",
  "type": "registry:ui",
  "dependencies": ["@ark-ui/solid", "lucide-solid", "solid-js"],
  "files": [
    {
      "content": "import { Clipboard } from '@ark-ui/solid/clipboard'\nimport { CheckIcon, CopyIcon } from 'lucide-solid'\nimport type { ComponentProps } from 'solid-js'\nimport { createStyleContext } from 'styled-system/jsx'\nimport { clipboard } from 'styled-system/recipes'\n\nconst { withProvider, withContext } = createStyleContext(clipboard)\n\nexport type RootProps = ComponentProps<typeof Root>\nexport const Root = withProvider(Clipboard.Root, 'root')\nexport const RootProvider = withProvider(Clipboard.RootProvider, 'root')\nexport const Control = withContext(Clipboard.Control, 'control')\nexport const Input = withContext(Clipboard.Input, 'input')\nexport const Label = withContext(Clipboard.Label, 'label')\nexport const Trigger = withContext(Clipboard.Trigger, 'trigger')\n\nexport { ClipboardContext as Context } from '@ark-ui/solid/clipboard'\n\ntype IndicatorProps = ComponentProps<typeof StyledIndicator>\n\nconst StyledIndicator = withContext(Clipboard.Indicator, 'indicator')\n\nexport const Indicator = (props: IndicatorProps) => {\n  return (\n    <StyledIndicator copied={<CheckIcon />} {...props}>\n      <CopyIcon />\n    </StyledIndicator>\n  )\n}\n\nexport const CopyText = (props: IndicatorProps) => {\n  return (\n    <StyledIndicator copied=\"Copied\" {...props}>\n      Copy\n    </StyledIndicator>\n  )\n}\n",
      "type": "registry:ui",
      "path": "clipboard.tsx"
    }
  ],
  "registryDependencies": ["clipboard-recipe"]
}
