{
  "$schema": "https://next.park-ui.com/schema/registry-item.json",
  "name": "switch",
  "type": "registry:ui",
  "dependencies": ["@ark-ui/solid", "solid-js"],
  "files": [
    {
      "content": "import { ark } from '@ark-ui/solid'\nimport { Switch, useSwitchContext } from '@ark-ui/solid/switch'\nimport { type ComponentProps, type JSX, Show, splitProps } from 'solid-js'\nimport { createStyleContext, styled } from 'styled-system/jsx'\nimport { switchRecipe } from 'styled-system/recipes'\n\nconst { withProvider, withContext } = createStyleContext(switchRecipe)\n\nexport type RootProps = ComponentProps<typeof Root>\nexport const Root = withProvider(Switch.Root, 'root')\nexport const RootProvider = withProvider(Switch.RootProvider, 'root')\nexport const Label = withContext(Switch.Label, 'label')\nexport const Thumb = withContext(Switch.Thumb, 'thumb')\nexport const HiddenInput = Switch.HiddenInput\n\nexport const Control = withContext(Switch.Control, 'control', {\n  defaultProps: () => ({ children: <Thumb /> }),\n})\n\nexport { SwitchContext as Context } from '@ark-ui/solid/switch'\n\ninterface IndicatorProps extends ComponentProps<typeof StyledIndicator> {\n  fallback?: JSX.Element | undefined\n}\n\nconst StyledIndicator = withContext(ark.span, 'indicator')\nexport const Indicator = (props: IndicatorProps) => {\n  const [local, rest] = splitProps(props, ['fallback', 'children'])\n  const api = useSwitchContext()\n\n  return (\n    <StyledIndicator data-checked={api().checked ? '' : undefined} {...rest}>\n      <Show when={api().checked} fallback={local.fallback}>\n        {local.children}\n      </Show>\n    </StyledIndicator>\n  )\n}\n\ninterface ThumbIndicatorProps extends ComponentProps<typeof StyledThumbIndicator> {\n  fallback?: JSX.Element | undefined\n}\n\nconst StyledThumbIndicator = styled(ark.span)\nexport const ThumbIndicator = (props: ThumbIndicatorProps) => {\n  const [local, rest] = splitProps(props, ['fallback', 'children'])\n  const api = useSwitchContext()\n\n  return (\n    <StyledThumbIndicator data-checked={api().checked ? '' : undefined} {...rest}>\n      <Show when={api().checked} fallback={local.fallback}>\n        {local.children}\n      </Show>\n    </StyledThumbIndicator>\n  )\n}\n",
      "type": "registry:ui",
      "path": "switch.tsx"
    }
  ],
  "registryDependencies": ["switch-recipe"]
}
