{
  "$schema": "https://next.park-ui.com/schema/registry-item.json",
  "name": "iris",
  "type": "registry:color",
  "dependencies": ["@pandacss/dev"],
  "files": [
    {
      "content": "import { defineSemanticTokens } from '@pandacss/dev'\n\nexport const iris = defineSemanticTokens.colors({\n  '1': { value: { _light: '#fdfdff', _dark: '#13131e' } },\n  '2': { value: { _light: '#f8f8ff', _dark: '#171625' } },\n  '3': { value: { _light: '#f0f1fe', _dark: '#202248' } },\n  '4': { value: { _light: '#e6e7ff', _dark: '#262a65' } },\n  '5': { value: { _light: '#dadcff', _dark: '#303374' } },\n  '6': { value: { _light: '#cbcdff', _dark: '#3d3e82' } },\n  '7': { value: { _light: '#b8baf8', _dark: '#4a4a95' } },\n  '8': { value: { _light: '#9b9ef0', _dark: '#5958b1' } },\n  '9': { value: { _light: '#5b5bd6', _dark: '#5b5bd6' } },\n  '10': { value: { _light: '#5151cd', _dark: '#6e6ade' } },\n  '11': { value: { _light: '#5753c6', _dark: '#b1a9ff' } },\n  '12': { value: { _light: '#272962', _dark: '#e0dffe' } },\n  a1: { value: { _light: '#0000ff02', _dark: '#3636fe0e' } },\n  a2: { value: { _light: '#0000ff07', _dark: '#564bf916' } },\n  a3: { value: { _light: '#0011ee0f', _dark: '#525bff3b' } },\n  a4: { value: { _light: '#000bff19', _dark: '#4d58ff5a' } },\n  a5: { value: { _light: '#000eff25', _dark: '#5b62fd6b' } },\n  a6: { value: { _light: '#000aff34', _dark: '#6d6ffd7a' } },\n  a7: { value: { _light: '#0008e647', _dark: '#7777fe8e' } },\n  a8: { value: { _light: '#0008d964', _dark: '#7b7afeac' } },\n  a9: { value: { _light: '#0000c0a4', _dark: '#6a6afed4' } },\n  a10: { value: { _light: '#0000b6ae', _dark: '#7d79ffdc' } },\n  a11: { value: { _light: '#0600abac', _dark: '#b1a9ff' } },\n  a12: { value: { _light: '#000246d8', _dark: '#e1e0fffe' } },\n  solid: {\n    bg: {\n      DEFAULT: { value: { _light: '{colors.iris.9}', _dark: '{colors.iris.9}' } },\n      hover: { value: { _light: '{colors.iris.10}', _dark: '{colors.iris.10}' } },\n    },\n    fg: { DEFAULT: { value: { _light: 'white', _dark: 'white' } } },\n  },\n  subtle: {\n    bg: {\n      DEFAULT: { value: { _light: '{colors.iris.a3}', _dark: '{colors.iris.a3}' } },\n      hover: { value: { _light: '{colors.iris.a4}', _dark: '{colors.iris.a4}' } },\n      active: { value: { _light: '{colors.iris.a5}', _dark: '{colors.iris.a5}' } },\n    },\n    fg: { DEFAULT: { value: { _light: '{colors.iris.a11}', _dark: '{colors.iris.a11}' } } },\n  },\n  surface: {\n    bg: {\n      DEFAULT: { value: { _light: '{colors.iris.a2}', _dark: '{colors.iris.a2}' } },\n      active: { value: { _light: '{colors.iris.a3}', _dark: '{colors.iris.a3}' } },\n    },\n    border: {\n      DEFAULT: { value: { _light: '{colors.iris.a6}', _dark: '{colors.iris.a6}' } },\n      hover: { value: { _light: '{colors.iris.a7}', _dark: '{colors.iris.a7}' } },\n    },\n    fg: { DEFAULT: { value: { _light: '{colors.iris.a11}', _dark: '{colors.iris.a11}' } } },\n  },\n  outline: {\n    bg: {\n      hover: { value: { _light: '{colors.iris.a2}', _dark: '{colors.iris.a2}' } },\n      active: { value: { _light: '{colors.iris.a3}', _dark: '{colors.iris.a3}' } },\n    },\n    border: { DEFAULT: { value: { _light: '{colors.iris.a7}', _dark: '{colors.iris.a7}' } } },\n    fg: { DEFAULT: { value: { _light: '{colors.iris.a11}', _dark: '{colors.iris.a11}' } } },\n  },\n  plain: {\n    bg: {\n      hover: { value: { _light: '{colors.iris.a3}', _dark: '{colors.iris.a3}' } },\n      active: { value: { _light: '{colors.iris.a4}', _dark: '{colors.iris.a4}' } },\n    },\n    fg: { DEFAULT: { value: { _light: '{colors.iris.a11}', _dark: '{colors.iris.a11}' } } },\n  },\n})\n",
      "type": "registry:color",
      "path": "colors/iris.ts"
    }
  ],
  "panda": {
    "extension": {
      "theme": {
        "extend": {
          "semanticTokens": {
            "colors": {
              "iris": "$ref:iris"
            }
          }
        }
      }
    }
  }
}
