{
  "$schema": "https://next.park-ui.com/schema/registry-item.json",
  "name": "amber",
  "type": "registry:color",
  "dependencies": ["@pandacss/dev"],
  "files": [
    {
      "content": "import { defineSemanticTokens } from '@pandacss/dev'\n\nexport const amber = defineSemanticTokens.colors({\n  '1': { value: { _light: '#fefdfb', _dark: '#16120c' } },\n  '2': { value: { _light: '#fefbe9', _dark: '#1d180f' } },\n  '3': { value: { _light: '#fff7c2', _dark: '#302008' } },\n  '4': { value: { _light: '#ffee9c', _dark: '#3f2700' } },\n  '5': { value: { _light: '#fbe577', _dark: '#4d3000' } },\n  '6': { value: { _light: '#f3d673', _dark: '#5c3d05' } },\n  '7': { value: { _light: '#e9c162', _dark: '#714f19' } },\n  '8': { value: { _light: '#e2a336', _dark: '#8f6424' } },\n  '9': { value: { _light: '#ffc53d', _dark: '#ffc53d' } },\n  '10': { value: { _light: '#ffba18', _dark: '#ffd60a' } },\n  '11': { value: { _light: '#ab6400', _dark: '#ffca16' } },\n  '12': { value: { _light: '#4f3422', _dark: '#ffe7b3' } },\n  a1: { value: { _light: '#c0800004', _dark: '#e63c0006' } },\n  a2: { value: { _light: '#f4d10016', _dark: '#fd9b000d' } },\n  a3: { value: { _light: '#ffde003d', _dark: '#fa820022' } },\n  a4: { value: { _light: '#ffd40063', _dark: '#fc820032' } },\n  a5: { value: { _light: '#f8cf0088', _dark: '#fd8b0041' } },\n  a6: { value: { _light: '#eab5008c', _dark: '#fd9b0051' } },\n  a7: { value: { _light: '#dc9b009d', _dark: '#ffab2567' } },\n  a8: { value: { _light: '#da8a00c9', _dark: '#ffae3587' } },\n  a9: { value: { _light: '#ffb300c2', _dark: '#ffc53d' } },\n  a10: { value: { _light: '#ffb300e7', _dark: '#ffd60a' } },\n  a11: { value: { _light: '#ab6400', _dark: '#ffca16' } },\n  a12: { value: { _light: '#341500dd', _dark: '#ffe7b3' } },\n  solid: {\n    bg: {\n      DEFAULT: { value: { _light: '{colors.amber.9}', _dark: '{colors.amber.9}' } },\n      hover: { value: { _light: '{colors.amber.10}', _dark: '{colors.amber.10}' } },\n    },\n    fg: { DEFAULT: { value: { _light: '{colors.gray.12}', _dark: '{colors.gray.1}' } } },\n  },\n  subtle: {\n    bg: {\n      DEFAULT: { value: { _light: '{colors.amber.a3}', _dark: '{colors.amber.a3}' } },\n      hover: { value: { _light: '{colors.amber.a4}', _dark: '{colors.amber.a4}' } },\n      active: { value: { _light: '{colors.amber.a5}', _dark: '{colors.amber.a5}' } },\n    },\n    fg: { DEFAULT: { value: { _light: '{colors.amber.a11}', _dark: '{colors.amber.a11}' } } },\n  },\n  surface: {\n    bg: {\n      DEFAULT: { value: { _light: '{colors.amber.a2}', _dark: '{colors.amber.a2}' } },\n      active: { value: { _light: '{colors.amber.a3}', _dark: '{colors.amber.a3}' } },\n    },\n    border: {\n      DEFAULT: { value: { _light: '{colors.amber.a6}', _dark: '{colors.amber.a6}' } },\n      hover: { value: { _light: '{colors.amber.a7}', _dark: '{colors.amber.a7}' } },\n    },\n    fg: { DEFAULT: { value: { _light: '{colors.amber.a11}', _dark: '{colors.amber.a11}' } } },\n  },\n  outline: {\n    bg: {\n      hover: { value: { _light: '{colors.amber.a2}', _dark: '{colors.amber.a2}' } },\n      active: { value: { _light: '{colors.amber.a3}', _dark: '{colors.amber.a3}' } },\n    },\n    border: { DEFAULT: { value: { _light: '{colors.amber.a7}', _dark: '{colors.amber.a7}' } } },\n    fg: { DEFAULT: { value: { _light: '{colors.amber.a11}', _dark: '{colors.amber.a11}' } } },\n  },\n  plain: {\n    bg: {\n      hover: { value: { _light: '{colors.amber.a3}', _dark: '{colors.amber.a3}' } },\n      active: { value: { _light: '{colors.amber.a4}', _dark: '{colors.amber.a4}' } },\n    },\n    fg: { DEFAULT: { value: { _light: '{colors.amber.a11}', _dark: '{colors.amber.a11}' } } },\n  },\n})\n",
      "type": "registry:color",
      "path": "colors/amber.ts"
    }
  ]
}
