{
  "$schema": "https://next.park-ui.com/schema/registry-item.json",
  "name": "pink",
  "type": "registry:color",
  "dependencies": ["@pandacss/dev"],
  "files": [
    {
      "content": "import { defineSemanticTokens } from '@pandacss/dev'\n\nexport const pink = defineSemanticTokens.colors({\n  '1': { value: { _light: '#fffcfe', _dark: '#191117' } },\n  '2': { value: { _light: '#fef7fb', _dark: '#21121d' } },\n  '3': { value: { _light: '#fee9f5', _dark: '#37172f' } },\n  '4': { value: { _light: '#fbdcef', _dark: '#4b143d' } },\n  '5': { value: { _light: '#f6cee7', _dark: '#591c47' } },\n  '6': { value: { _light: '#efbfdd', _dark: '#692955' } },\n  '7': { value: { _light: '#e7acd0', _dark: '#833869' } },\n  '8': { value: { _light: '#dd93c2', _dark: '#a84885' } },\n  '9': { value: { _light: '#d6409f', _dark: '#d6409f' } },\n  '10': { value: { _light: '#cf3897', _dark: '#de51a8' } },\n  '11': { value: { _light: '#c2298a', _dark: '#ff8dcc' } },\n  '12': { value: { _light: '#651249', _dark: '#fdd1ea' } },\n  a1: { value: { _light: '#ff00aa03', _dark: '#f412bc09' } },\n  a2: { value: { _light: '#e0008008', _dark: '#f420bb12' } },\n  a3: { value: { _light: '#f4008c16', _dark: '#fe37cc29' } },\n  a4: { value: { _light: '#e2008b23', _dark: '#fc1ec43f' } },\n  a5: { value: { _light: '#d1008331', _dark: '#fd35c24e' } },\n  a6: { value: { _light: '#c0007840', _dark: '#fd51c75f' } },\n  a7: { value: { _light: '#b6006f53', _dark: '#fd62c87b' } },\n  a8: { value: { _light: '#af006f6c', _dark: '#ff68c8a2' } },\n  a9: { value: { _light: '#c8007fbf', _dark: '#fe49bcd4' } },\n  a10: { value: { _light: '#c2007ac7', _dark: '#ff5cc0dc' } },\n  a11: { value: { _light: '#b60074d6', _dark: '#ff8dcc' } },\n  a12: { value: { _light: '#59003bed', _dark: '#ffd3ecfd' } },\n  solid: {\n    bg: {\n      DEFAULT: { value: { _light: '{colors.pink.9}', _dark: '{colors.pink.9}' } },\n      hover: { value: { _light: '{colors.pink.10}', _dark: '{colors.pink.10}' } },\n    },\n    fg: { DEFAULT: { value: { _light: 'white', _dark: 'white' } } },\n  },\n  subtle: {\n    bg: {\n      DEFAULT: { value: { _light: '{colors.pink.a3}', _dark: '{colors.pink.a3}' } },\n      hover: { value: { _light: '{colors.pink.a4}', _dark: '{colors.pink.a4}' } },\n      active: { value: { _light: '{colors.pink.a5}', _dark: '{colors.pink.a5}' } },\n    },\n    fg: { DEFAULT: { value: { _light: '{colors.pink.a11}', _dark: '{colors.pink.a11}' } } },\n  },\n  surface: {\n    bg: {\n      DEFAULT: { value: { _light: '{colors.pink.a2}', _dark: '{colors.pink.a2}' } },\n      active: { value: { _light: '{colors.pink.a3}', _dark: '{colors.pink.a3}' } },\n    },\n    border: {\n      DEFAULT: { value: { _light: '{colors.pink.a6}', _dark: '{colors.pink.a6}' } },\n      hover: { value: { _light: '{colors.pink.a7}', _dark: '{colors.pink.a7}' } },\n    },\n    fg: { DEFAULT: { value: { _light: '{colors.pink.a11}', _dark: '{colors.pink.a11}' } } },\n  },\n  outline: {\n    bg: {\n      hover: { value: { _light: '{colors.pink.a2}', _dark: '{colors.pink.a2}' } },\n      active: { value: { _light: '{colors.pink.a3}', _dark: '{colors.pink.a3}' } },\n    },\n    border: { DEFAULT: { value: { _light: '{colors.pink.a7}', _dark: '{colors.pink.a7}' } } },\n    fg: { DEFAULT: { value: { _light: '{colors.pink.a11}', _dark: '{colors.pink.a11}' } } },\n  },\n  plain: {\n    bg: {\n      hover: { value: { _light: '{colors.pink.a3}', _dark: '{colors.pink.a3}' } },\n      active: { value: { _light: '{colors.pink.a4}', _dark: '{colors.pink.a4}' } },\n    },\n    fg: { DEFAULT: { value: { _light: '{colors.pink.a11}', _dark: '{colors.pink.a11}' } } },\n  },\n})\n",
      "type": "registry:color",
      "path": "colors/pink.ts"
    }
  ],
  "panda": {
    "imports": [
      {
        "type": "registry:color",
        "name": "pink",
        "from": "colors/pink"
      }
    ],
    "extension": {
      "theme": {
        "extend": {
          "semanticTokens": {
            "colors": {
              "pink": "$ref:pink"
            }
          }
        }
      }
    }
  }
}
