{
  "$schema": "https://park-ui.com/schema/registry-item.json",
  "name": "absolute-center",
  "type": "registry:ui",
  "dependencies": ["@ark-ui/solid", "solid-js"],
  "files": [
    {
      "content": "import { ark } from '@ark-ui/solid/factory'\nimport type { ComponentProps } from 'solid-js'\nimport { styled } from 'styled-system/jsx'\nimport { absoluteCenter } from 'styled-system/recipes'\n\nexport type AbsoluteCenterProps = ComponentProps<typeof AbsoluteCenter>\nexport const AbsoluteCenter = styled(ark.div, absoluteCenter)\n",
      "type": "registry:ui",
      "path": "absolute-center.tsx"
    }
  ],
  "registryDependencies": ["absolute-center-recipe"]
}
